Review,Liked,CleanedText,ProcessedText,Sentiment
Wow... Loved this place.,1,Wow Loved this place,wow loved place,positive
Crust is not good.,0,Crust is not good,crust good,negative
Not tasty and the texture was just nasty.,0,Not tasty and the texture was just nasty,tasty texture nasty,negative
Stopped by during the late May bank holiday off Rick Steve recommendation and loved it.,1,Stopped by during the late May bank holiday off Rick Steve recommendation and loved it,stopped late may bank holiday rick steve recommendation loved,positive
The selection on the menu was great and so were the prices.,1,The selection on the menu was great and so were the prices,selection menu great price,positive
Now I am getting angry and I want my damn pho.,0,Now I am getting angry and I want my damn pho,getting angry want damn pho,negative
Honeslty it didn't taste THAT fresh.),0,Honeslty it didnt taste THAT fresh,honeslty didnt taste fresh,negative
The potatoes were like rubber and you could tell they had been made up ahead of time being kept under a warmer.,0,The potatoes were like rubber and you could tell they had been made up ahead of time being kept under a warmer,potato like rubber could tell made ahead time kept warmer,negative
The fries were great too.,1,The fries were great too,fry great,positive
A great touch.,1,A great touch,great touch,positive
Service was very prompt.,1,Service was very prompt,service prompt,positive
Would not go back.,0,Would not go back,would go back,negative
The cashier had no care what so ever on what I had to say it still ended up being wayyy overpriced.,0,The cashier had no care what so ever on what I had to say it still ended up being wayyy overpriced,cashier care ever say still ended wayyy overpriced,negative
"I tried the Cape Cod ravoli, chicken, with cranberry...mmmm!",1,I tried the Cape Cod ravoli chicken with cranberrymmmm,tried cape cod ravoli chicken cranberrymmmm,positive
I was disgusted because I was pretty sure that was human hair.,0,I was disgusted because I was pretty sure that was human hair,disgusted pretty sure human hair,negative
I was shocked because no signs indicate cash only.,0,I was shocked because no signs indicate cash only,shocked sign indicate cash,negative
Highly recommended.,1,Highly recommended,highly recommended,positive
Waitress was a little slow in service.,0,Waitress was a little slow in service,waitress little slow service,negative
"This place is not worth your time, let alone Vegas.",0,This place is not worth your time let alone Vegas,place worth time let alone vega,negative
did not like at all.,0,did not like at all,like,negative
The Burrittos Blah!,0,The Burrittos Blah,burrittos blah,negative
"The food, amazing.",1,The food amazing,food amazing,positive
Service is also cute.,1,Service is also cute,service also cute,positive
I could care less... The interior is just beautiful.,1,I could care less The interior is just beautiful,could care less interior beautiful,positive
So they performed.,1,So they performed,performed,positive
That's right....the red velvet cake.....ohhh this stuff is so good.,1,Thats rightthe red velvet cakeohhh this stuff is so good,thats rightthe red velvet cakeohhh stuff good,positive
- They never brought a salad we asked for.,0, They never brought a salad we asked for,never brought salad asked,negative
"This hole in the wall has great Mexican street tacos, and friendly staff.",1,This hole in the wall has great Mexican street tacos and friendly staff,hole wall great mexican street taco friendly staff,positive
"Took an hour to get our food only 4 tables in restaurant my food was Luke warm, Our sever was running around like he was totally overwhelmed.",0,Took an hour to get our food only  tables in restaurant my food was Luke warm Our sever was running around like he was totally overwhelmed,took hour get food table restaurant food luke warm sever running around like totally overwhelmed,negative
The worst was the salmon sashimi.,0,The worst was the salmon sashimi,worst salmon sashimi,negative
"Also there are combos like a burger, fries, and beer for 23 which is a decent deal.",1,Also there are combos like a burger fries and beer for  which is a decent deal,also combo like burger fry beer decent deal,positive
This was like the final blow!,0,This was like the final blow,like final blow,negative
I found this place by accident and I could not be happier.,1,I found this place by accident and I could not be happier,found place accident could happier,positive
"seems like a good quick place to grab a bite of some familiar pub food, but do yourself a favor and look elsewhere.",0,seems like a good quick place to grab a bite of some familiar pub food but do yourself a favor and look elsewhere,seems like good quick place grab bite familiar pub food favor look elsewhere,negative
"Overall, I like this place a lot.",1,Overall I like this place a lot,overall like place lot,positive
The only redeeming quality of the restaurant was that it was very inexpensive.,1,The only redeeming quality of the restaurant was that it was very inexpensive,redeeming quality restaurant inexpensive,positive
Ample portions and good prices.,1,Ample portions and good prices,ample portion good price,positive
"Poor service, the waiter made me feel like I was stupid every time he came to the table.",0,Poor service the waiter made me feel like I was stupid every time he came to the table,poor service waiter made feel like stupid every time came table,negative
My first visit to Hiro was a delight!,1,My first visit to Hiro was a delight,first visit hiro delight,positive
Service sucks.,0,Service sucks,service suck,negative
The shrimp tender and moist.,1,The shrimp tender and moist,shrimp tender moist,positive
There is not a deal good enough that would drag me into that establishment again.,0,There is not a deal good enough that would drag me into that establishment again,deal good enough would drag establishment,negative
Hard to judge whether these sides were good because we were grossed out by the melted styrofoam and didn't want to eat it for fear of getting sick.,0,Hard to judge whether these sides were good because we were grossed out by the melted styrofoam and didnt want to eat it for fear of getting sick,hard judge whether side good grossed melted styrofoam didnt want eat fear getting sick,negative
"On a positive note, our server was very attentive and provided great service.",1,On a positive note our server was very attentive and provided great service,positive note server attentive provided great service,positive
"Frozen pucks of disgust, with some of the worst people behind the register.",0,Frozen pucks of disgust with some of the worst people behind the register,frozen puck disgust worst people behind register,negative
The only thing I did like was the prime rib and dessert section.,1,The only thing I did like was the prime rib and dessert section,thing like prime rib dessert section,positive
It's too bad the food is so damn generic.,0,Its too bad the food is so damn generic,bad food damn generic,negative
"The burger is good beef, cooked just right.",1,The burger is good beef cooked just right,burger good beef cooked right,positive
If you want a sandwich just go to any Firehouse!!!!!,1,If you want a sandwich just go to any Firehouse,want sandwich go firehouse,positive
"My side Greek salad with the Greek dressing was so tasty, and the pita and hummus was very refreshing.",1,My side Greek salad with the Greek dressing was so tasty and the pita and hummus was very refreshing,side greek salad greek dressing tasty pita hummus refreshing,positive
We ordered the duck rare and it was pink and tender on the inside with a nice char on the outside.,1,We ordered the duck rare and it was pink and tender on the inside with a nice char on the outside,ordered duck rare pink tender inside nice char outside,positive
He came running after us when he realized my husband had left his sunglasses on the table.,1,He came running after us when he realized my husband had left his sunglasses on the table,came running u realized husband left sunglass table,positive
Their chow mein is so good!,1,Their chow mein is so good,chow mein good,positive
"They have horrible attitudes towards customers, and talk down to each one when customers don't enjoy their food.",0,They have horrible attitudes towards customers and talk down to each one when customers dont enjoy their food,horrible attitude towards customer talk one customer dont enjoy food,negative
The portion was huge!,1,The portion was huge,portion huge,positive
"Loved it...friendly servers, great food, wonderful and imaginative menu.",1,Loved itfriendly servers great food wonderful and imaginative menu,loved itfriendly server great food wonderful imaginative menu,positive
The Heart Attack Grill in downtown Vegas is an absolutely flat-lined excuse for a restaurant.,0,The Heart Attack Grill in downtown Vegas is an absolutely flatlined excuse for a restaurant,heart attack grill downtown vega absolutely flatlined excuse restaurant,negative
Not much seafood and like 5 strings of pasta at the bottom.,0,Not much seafood and like  strings of pasta at the bottom,much seafood like string pasta bottom,negative
"The salad had just the right amount of sauce to not over power the scallop, which was perfectly cooked.",1,The salad had just the right amount of sauce to not over power the scallop which was perfectly cooked,salad right amount sauce power scallop perfectly cooked,positive
"The ripped banana was not only ripped, but petrified and tasteless.",0,The ripped banana was not only ripped but petrified and tasteless,ripped banana ripped petrified tasteless,negative
At least think to refill my water before I struggle to wave you over for 10 minutes.,0,At least think to refill my water before I struggle to wave you over for  minutes,least think refill water struggle wave minute,negative
This place receives stars for their APPETIZERS!!!,1,This place receives stars for their APPETIZERS,place receives star appetizer,positive
The cocktails are all handmade and delicious.,1,The cocktails are all handmade and delicious,cocktail handmade delicious,positive
We'd definitely go back here again.,1,Wed definitely go back here again,wed definitely go back,positive
We are so glad we found this place.,1,We are so glad we found this place,glad found place,positive
"Great food and service, huge portions and they give a military discount.",1,Great food and service huge portions and they give a military discount,great food service huge portion give military discount,positive
Always a great time at Dos Gringos!,1,Always a great time at Dos Gringos,always great time do gringo,positive
Update.....went back for a second time and it was still just as amazing,1,Updatewent back for a second time and it was still just as amazing,updatewent back second time still amazing,positive
We got the food and apparently they have never heard of salt and the batter on the fish was chewy.,0,We got the food and apparently they have never heard of salt and the batter on the fish was chewy,got food apparently never heard salt batter fish chewy,negative
A great way to finish a great.,1,A great way to finish a great,great way finish great,positive
"The deal included 5 tastings and 2 drinks, and Jeff went above and beyond what we expected.",1,The deal included  tastings and  drinks and Jeff went above and beyond what we expected,deal included tasting drink jeff went beyond expected,positive
"- Really, really good rice, all the time.",1, Really really good rice all the time,really really good rice time,positive
The service was meh.,0,The service was meh,service meh,negative
"It took over 30 min to get their milkshake, which was nothing more than chocolate milk.",0,It took over  min to get their milkshake which was nothing more than chocolate milk,took min get milkshake nothing chocolate milk,negative
"I guess I should have known that this place would suck, because it is inside of the Excalibur, but I didn't use my common sense.",0,I guess I should have known that this place would suck because it is inside of the Excalibur but I didnt use my common sense,guess known place would suck inside excalibur didnt use common sense,negative
The scallop dish is quite appalling for value as well.,0,The scallop dish is quite appalling for value as well,scallop dish quite appalling value well,negative
2 times - Very Bad Customer Service !,0, times  Very Bad Customer Service ,time bad customer service,negative
The sweet potato fries were very good and seasoned well.,1,The sweet potato fries were very good and seasoned well,sweet potato fry good seasoned well,positive
Today is the second time I've been to their lunch buffet and it was pretty good.,1,Today is the second time Ive been to their lunch buffet and it was pretty good,today second time ive lunch buffet pretty good,positive
There is so much good food in Vegas that I feel cheated for wasting an eating opportunity by going to Rice and Company.,0,There is so much good food in Vegas that I feel cheated for wasting an eating opportunity by going to Rice and Company,much good food vega feel cheated wasting eating opportunity going rice company,negative
Coming here is like experiencing an underwhelming relationship where both parties can't wait for the other person to ask to break up.,0,Coming here is like experiencing an underwhelming relationship where both parties cant wait for the other person to ask to break up,coming like experiencing underwhelming relationship party cant wait person ask break,negative
walked in and the place smelled like an old grease trap and only 2 others there eating.,0,walked in and the place smelled like an old grease trap and only  others there eating,walked place smelled like old grease trap others eating,negative
The turkey and roast beef were bland.,0,The turkey and roast beef were bland,turkey roast beef bland,negative
This place has it!,1,This place has it,place,positive
The pan cakes everyone are raving about taste like a sugary disaster tailored to the palate of a six year old.,0,The pan cakes everyone are raving about taste like a sugary disaster tailored to the palate of a six year old,pan cake everyone raving taste like sugary disaster tailored palate six year old,negative
I love the Pho and the spring rolls oh so yummy you have to try.,1,I love the Pho and the spring rolls oh so yummy you have to try,love pho spring roll oh yummy try,positive
The poor batter to meat ratio made the chicken tenders very unsatisfying.,0,The poor batter to meat ratio made the chicken tenders very unsatisfying,poor batter meat ratio made chicken tender unsatisfying,negative
All I have to say is the food was amazing!!!,1,All I have to say is the food was amazing,say food amazing,positive
Omelets are to die for!,1,Omelets are to die for,omelet die,positive
Everything was fresh and delicious!,1,Everything was fresh and delicious,everything fresh delicious,positive
"In summary, this was a largely disappointing dining experience.",0,In summary this was a largely disappointing dining experience,summary largely disappointing dining experience,negative
"It's like a really sexy party in your mouth, where you're outrageously flirting with the hottest person at the party.",1,Its like a really sexy party in your mouth where youre outrageously flirting with the hottest person at the party,like really sexy party mouth youre outrageously flirting hottest person party,positive
"Never been to Hard Rock Casino before, WILL NEVER EVER STEP FORWARD IN IT AGAIN!",0,Never been to Hard Rock Casino before WILL NEVER EVER STEP FORWARD IN IT AGAIN,never hard rock casino never ever step forward,negative
Best breakfast buffet!!!,1,Best breakfast buffet,best breakfast buffet,positive
say bye bye to your tip lady!,0,say bye bye to your tip lady,say bye bye tip lady,negative
We'll never go again.,0,Well never go again,well never go,negative
Will be back again!,1,Will be back again,back,positive
Food arrived quickly!,1,Food arrived quickly,food arrived quickly,positive
It was not good.,0,It was not good,good,negative
"On the up side, their cafe serves really good food.",1,On the up side their cafe serves really good food,side cafe serf really good food,positive
"Our server was fantastic and when he found out the wife loves roasted garlic and bone marrow, he added extra to our meal and another marrow to go!",1,Our server was fantastic and when he found out the wife loves roasted garlic and bone marrow he added extra to our meal and another marrow to go,server fantastic found wife love roasted garlic bone marrow added extra meal another marrow go,positive
"The only good thing was our waiter, he was very helpful and kept the bloddy mary's coming.",1,The only good thing was our waiter he was very helpful and kept the bloddy marys coming,good thing waiter helpful kept bloddy mary coming,positive
"Best Buffet in town, for the price you cannot beat it.",1,Best Buffet in town for the price you cannot beat it,best buffet town price beat,positive
"I LOVED their mussels cooked in this wine reduction, the duck was tender, and their potato dishes were delicious.",1,I LOVED their mussels cooked in this wine reduction the duck was tender and their potato dishes were delicious,loved mussel cooked wine reduction duck tender potato dish delicious,positive
This is one of the better buffets that I have been to.,1,This is one of the better buffets that I have been to,one better buffet,positive
So we went to Tigerlilly and had a fantastic afternoon!,1,So we went to Tigerlilly and had a fantastic afternoon,went tigerlilly fantastic afternoon,positive
"The food was delicious, our bartender was attentive and personable AND we got a great deal!",1,The food was delicious our bartender was attentive and personable AND we got a great deal,food delicious bartender attentive personable got great deal,positive
The ambience is wonderful and there is music playing.,1,The ambience is wonderful and there is music playing,ambience wonderful music playing,positive
Will go back next trip out.,1,Will go back next trip out,go back next trip,positive
Sooooo good!!,1,Sooooo good,sooooo good,positive
"REAL sushi lovers, let's be honest - Yama is not that good.",0,REAL sushi lovers lets be honest  Yama is not that good,real sushi lover let honest yama good,negative
"At least 40min passed in between us ordering and the food arriving, and it wasn't that busy.",0,At least min passed in between us ordering and the food arriving and it wasnt that busy,least min passed u ordering food arriving wasnt busy,negative
This is a really fantastic Thai restaurant which is definitely worth a visit.,1,This is a really fantastic Thai restaurant which is definitely worth a visit,really fantastic thai restaurant definitely worth visit,positive
"Nice, spicy and tender.",1,Nice spicy and tender,nice spicy tender,positive
Good prices.,1,Good prices,good price,positive
Check it out.,1,Check it out,check,positive
It was pretty gross!,0,It was pretty gross,pretty gross,negative
I've had better atmosphere.,0,Ive had better atmosphere,ive better atmosphere,negative
Kind of hard to mess up a steak but they did.,0,Kind of hard to mess up a steak but they did,kind hard mess steak,negative
"Although I very much liked the look and sound of this place, the actual experience was a bit disappointing.",0,Although I very much liked the look and sound of this place the actual experience was a bit disappointing,although much liked look sound place actual experience bit disappointing,negative
I just don't know how this place managed to served the blandest food I have ever eaten when they are preparing Indian cuisine.,0,I just dont know how this place managed to served the blandest food I have ever eaten when they are preparing Indian cuisine,dont know place managed served blandest food ever eaten preparing indian cuisine,negative
"Worst service to boot, but that is the least of their worries.",0,Worst service to boot but that is the least of their worries,worst service boot least worry,negative
Service was fine and the waitress was friendly.,1,Service was fine and the waitress was friendly,service fine waitress friendly,positive
"The guys all had steaks, and our steak loving son who has had steak at the best and worst places said it was the best steak he's ever eaten.",1,The guys all had steaks and our steak loving son who has had steak at the best and worst places said it was the best steak hes ever eaten,guy steak steak loving son steak best worst place said best steak he ever eaten,positive
"We thought you'd have to venture further away to get good sushi, but this place really hit the spot that night.",1,We thought youd have to venture further away to get good sushi but this place really hit the spot that night,thought youd venture away get good sushi place really hit spot night,positive
"Host staff were, for lack of a better word, BITCHES!",0,Host staff were for lack of a better word BITCHES,host staff lack better word bitch,negative
Bland... Not a liking this place for a number of reasons and I don't want to waste time on bad reviewing.. I'll leave it at that...,0,Bland Not a liking this place for a number of reasons and I dont want to waste time on bad reviewing Ill leave it at that,bland liking place number reason dont want waste time bad reviewing ill leave,negative
"Phenomenal food, service and ambiance.",1,Phenomenal food service and ambiance,phenomenal food service ambiance,positive
I wouldn't return.,0,I wouldnt return,wouldnt return,negative
"Definitely worth venturing off the strip for the pork belly, will return next time I'm in Vegas.",1,Definitely worth venturing off the strip for the pork belly will return next time Im in Vegas,definitely worth venturing strip pork belly return next time im vega,positive
This place is way too overpriced for mediocre food.,0,This place is way too overpriced for mediocre food,place way overpriced mediocre food,negative
Penne vodka excellent!,1,Penne vodka excellent,penne vodka excellent,positive
"They have a good selection of food including a massive meatloaf sandwich, a crispy chicken wrap, a delish tuna melt and some tasty burgers.",1,They have a good selection of food including a massive meatloaf sandwich a crispy chicken wrap a delish tuna melt and some tasty burgers,good selection food including massive meatloaf sandwich crispy chicken wrap delish tuna melt tasty burger,positive
The management is rude.,0,The management is rude,management rude,negative
"Delicious NYC bagels, good selections of cream cheese, real Lox with capers even.",1,Delicious NYC bagels good selections of cream cheese real Lox with capers even,delicious nyc bagel good selection cream cheese real lox caper even,positive
"Great Subway, in fact it's so good when you come here every other Subway will not meet your expectations.",1,Great Subway in fact its so good when you come here every other Subway will not meet your expectations,great subway fact good come every subway meet expectation,positive
I had a seriously solid breakfast here.,1,I had a seriously solid breakfast here,seriously solid breakfast,positive
This is one of the best bars with food in Vegas.,1,This is one of the best bars with food in Vegas,one best bar food vega,positive
"He was extremely rude and really, there are so many other restaurants I would love to dine at during a weekend in Vegas.",0,He was extremely rude and really there are so many other restaurants I would love to dine at during a weekend in Vegas,extremely rude really many restaurant would love dine weekend vega,negative
My drink was never empty and he made some really great menu suggestions.,1,My drink was never empty and he made some really great menu suggestions,drink never empty made really great menu suggestion,positive
Don't do it!!!!,0,Dont do it,dont,negative
The waiter wasn't helpful or friendly and rarely checked on us.,0,The waiter wasnt helpful or friendly and rarely checked on us,waiter wasnt helpful friendly rarely checked u,negative
My husband and I ate lunch here and were very disappointed with the food and service.,0,My husband and I ate lunch here and were very disappointed with the food and service,husband ate lunch disappointed food service,negative
And the red curry had so much bamboo shoots and wasn't very tasty to me.,0,And the red curry had so much bamboo shoots and wasnt very tasty to me,red curry much bamboo shoot wasnt tasty,negative
Nice blanket of moz over top but i feel like this was done to cover up the subpar food.,1,Nice blanket of moz over top but i feel like this was done to cover up the subpar food,nice blanket moz top feel like done cover subpar food,positive
The bathrooms are clean and the place itself is well decorated.,1,The bathrooms are clean and the place itself is well decorated,bathroom clean place well decorated,positive
"The menu is always changing, food quality is going down & service is extremely slow.",0,The menu is always changing food quality is going down  service is extremely slow,menu always changing food quality going service extremely slow,negative
"The service was a little slow , considering that were served by 3 people servers so the food was coming in a slow pace.",0,The service was a little slow  considering that were served by  people servers so the food was coming in a slow pace,service little slow considering served people server food coming slow pace,negative
I give it 2 thumbs down,0,I give it  thumbs down,give thumb,negative
We watched our waiter pay a lot more attention to other tables and ignore us.,0,We watched our waiter pay a lot more attention to other tables and ignore us,watched waiter pay lot attention table ignore u,negative
