Review,Liked,CleanedText,ProcessedText,Sentiment
"The staff is always super friendly and helpful, which is especially cool when you bring two small boys and a baby!",1,The staff is always super friendly and helpful which is especially cool when you bring two small boys and a baby,staff always super friendly helpful especially cool bring two small boy baby,positive
Four stars for the food & the guy in the blue shirt for his great vibe & still letting us in to eat !,1,Four stars for the food  the guy in the blue shirt for his great vibe  still letting us in to eat ,four star food guy blue shirt great vibe still letting u eat,positive
The roast beef sandwich tasted really good!,1,The roast beef sandwich tasted really good,roast beef sandwich tasted really good,positive
"Same evening, him and I are both drastically sick.",0,Same evening him and I are both drastically sick,evening drastically sick,negative
High-quality chicken on the chicken Caesar salad.,1,Highquality chicken on the chicken Caesar salad,highquality chicken chicken caesar salad,positive
Ordered burger rare came in we'll done.,0,Ordered burger rare came in well done,ordered burger rare came well done,negative
We were promptly greeted and seated.,1,We were promptly greeted and seated,promptly greeted seated,positive
Tried to go here for lunch and it was a madhouse.,0,Tried to go here for lunch and it was a madhouse,tried go lunch madhouse,negative
"I was proven dead wrong by this sushi bar, not only because the quality is great, but the service is fast and the food, impeccable.",1,I was proven dead wrong by this sushi bar not only because the quality is great but the service is fast and the food impeccable,proven dead wrong sushi bar quality great service fast food impeccable,positive
"After waiting an hour and being seated, I was not in the greatest of moods.",0,After waiting an hour and being seated I was not in the greatest of moods,waiting hour seated greatest mood,negative
This is a good joint.,1,This is a good joint,good joint,positive
The Macarons here are insanely good.,1,The Macarons here are insanely good,macarons insanely good,positive
I'm not eating here!,0,Im not eating here,im eating,negative
"Our waiter was very attentive, friendly, and informative.",1,Our waiter was very attentive friendly and informative,waiter attentive friendly informative,positive
Maybe if they weren't cold they would have been somewhat edible.,0,Maybe if they werent cold they would have been somewhat edible,maybe werent cold would somewhat edible,negative
This place has a lot of promise but fails to deliver.,0,This place has a lot of promise but fails to deliver,place lot promise fails deliver,negative
Very bad Experience!,0,Very bad Experience,bad experience,negative
What a mistake.,0,What a mistake,mistake,negative
Food was average at best.,0,Food was average at best,food average best,negative
Great food.,1,Great food,great food,positive
We won't be going back anytime soon!,0,We wont be going back anytime soon,wont going back anytime soon,negative
Very Very Disappointed ordered the $35 Big Bay Plater.,0,Very Very Disappointed ordered the  Big Bay Plater,disappointed ordered big bay plater,negative
Great place to relax and have an awesome burger and beer.,1,Great place to relax and have an awesome burger and beer,great place relax awesome burger beer,positive
It is PERFECT for a sit-down family meal or get together with a few friends.,1,It is PERFECT for a sitdown family meal or get together with a few friends,perfect sitdown family meal get together friend,positive
"Not much flavor to them, and very poorly constructed.",0,Not much flavor to them and very poorly constructed,much flavor poorly constructed,negative
The patio seating was very comfortable.,1,The patio seating was very comfortable,patio seating comfortable,positive
The fried rice was dry as well.,0,The fried rice was dry as well,fried rice dry well,negative
Hands down my favorite Italian restaurant!,1,Hands down my favorite Italian restaurant,hand favorite italian restaurant,positive
"That just SCREAMS ""LEGIT"" in my book...somethat's also pretty rare here in Vegas.",1,That just SCREAMS LEGIT in my booksomethats also pretty rare here in Vegas,scream legit booksomethats also pretty rare vega,positive
It was just not a fun experience.,1,It was just not a fun experience,fun experience,positive
The atmosphere was great with a lovely duo of violinists playing songs we requested.,1,The atmosphere was great with a lovely duo of violinists playing songs we requested,atmosphere great lovely duo violinist playing song requested,positive
"I personally love the hummus, pita, baklava, falafels and Baba Ganoush (it's amazing what they do with eggplant!).",1,I personally love the hummus pita baklava falafels and Baba Ganoush its amazing what they do with eggplant,personally love hummus pita baklava falafel baba ganoush amazing eggplant,positive
"Very convenient, since we were staying at the MGM!",1,Very convenient since we were staying at the MGM,convenient since staying mgm,positive
The owners are super friendly and the staff is courteous.,1,The owners are super friendly and the staff is courteous,owner super friendly staff courteous,positive
Both great!,1,Both great,great,positive
Eclectic selection.,1,Eclectic selection,eclectic selection,positive
The sweet potato tots were good but the onion rings were perfection or as close as I have had.,1,The sweet potato tots were good but the onion rings were perfection or as close as I have had,sweet potato tot good onion ring perfection close,positive
The staff was very attentive.,1,The staff was very attentive,staff attentive,positive
And the chef was generous with his time (even came around twice so we can take pictures with him).,1,And the chef was generous with his time even came around twice so we can take pictures with him,chef generous time even came around twice take picture,positive
"The owner used to work at Nobu, so this place is really similar for half the price.",1,The owner used to work at Nobu so this place is really similar for half the price,owner used work nobu place really similar half price,positive
Google mediocre and I imagine Smashburger will pop up.,0,Google mediocre and I imagine Smashburger will pop up,google mediocre imagine smashburger pop,negative
dont go here.,0,dont go here,dont go,negative
I promise they won't disappoint.,1,I promise they wont disappoint,promise wont disappoint,positive
As a sushi lover avoid this place by all means.,0,As a sushi lover avoid this place by all means,sushi lover avoid place mean,negative
What a great double cheeseburger!,1,What a great double cheeseburger,great double cheeseburger,positive
Awesome service and food.,1,Awesome service and food,awesome service food,positive
A fantastic neighborhood gem !!!,1,A fantastic neighborhood gem ,fantastic neighborhood gem,positive
I can't wait to go back.,1,I cant wait to go back,cant wait go back,positive
The plantains were the worst I've ever tasted.,0,The plantains were the worst Ive ever tasted,plantain worst ive ever tasted,negative
It's a great place and I highly recommend it.,1,Its a great place and I highly recommend it,great place highly recommend,positive
Service was slow and not attentive.,0,Service was slow and not attentive,service slow attentive,negative
"I gave it 5 stars then, and I'm giving it 5 stars now.",1,I gave it  stars then and Im giving it  stars now,gave star im giving star,positive
Your staff spends more time talking to themselves than me.,0,Your staff spends more time talking to themselves than me,staff spends time talking,negative
Dessert: Panna Cotta was amazing.,1,Dessert Panna Cotta was amazing,dessert panna cotta amazing,positive
"Very good food, great atmosphere.1",1,Very good food great atmosphere,good food great atmosphere,positive
Damn good steak.,1,Damn good steak,damn good steak,positive
Total brunch fail.,0,Total brunch fail,total brunch fail,negative
"Prices are very reasonable, flavors are spot on, the sauce is home made, and the slaw is not drenched in mayo.",1,Prices are very reasonable flavors are spot on the sauce is home made and the slaw is not drenched in mayo,price reasonable flavor spot sauce home made slaw drenched mayo,positive
"The decor is nice, and the piano music soundtrack is pleasant.",1,The decor is nice and the piano music soundtrack is pleasant,decor nice piano music soundtrack pleasant,positive
The steak was amazing...rge fillet relleno was the best seafood plate i have ever had!,1,The steak was amazingrge fillet relleno was the best seafood plate i have ever had,steak amazingrge fillet relleno best seafood plate ever,positive
"Good food , good service .",1,Good food  good service ,good food good service,positive
It was absolutely amazing.,1,It was absolutely amazing,absolutely amazing,positive
"I probably won't be back, to be honest.",0,I probably wont be back to be honest,probably wont back honest,negative
will definitely be back!,1,will definitely be back,definitely back,positive
The sergeant pepper beef sandwich with auju sauce is an excellent sandwich as well.,1,The sergeant pepper beef sandwich with auju sauce is an excellent sandwich as well,sergeant pepper beef sandwich auju sauce excellent sandwich well,positive
"Hawaiian Breeze, Mango Magic, and Pineapple Delight are the smoothies that I've tried so far and they're all good.",1,Hawaiian Breeze Mango Magic and Pineapple Delight are the smoothies that Ive tried so far and theyre all good,hawaiian breeze mango magic pineapple delight smoothy ive tried far theyre good,positive
Went for lunch - service was slow.,0,Went for lunch  service was slow,went lunch service slow,negative
"We had so much to say about the place before we walked in that he expected it to be amazing, but was quickly disappointed.",0,We had so much to say about the place before we walked in that he expected it to be amazing but was quickly disappointed,much say place walked expected amazing quickly disappointed,negative
I was mortified.,0,I was mortified,mortified,negative
"Needless to say, we will never be back here again.",0,Needless to say we will never be back here again,needless say never back,negative
"Anyways, The food was definitely not filling at all, and for the price you pay you should expect more.",0,Anyways The food was definitely not filling at all and for the price you pay you should expect more,anyways food definitely filling price pay expect,negative
"The chips that came out were dripping with grease, and mostly not edible.",0,The chips that came out were dripping with grease and mostly not edible,chip came dripping grease mostly edible,negative
I wasn't really impressed with Strip Steak.,0,I wasnt really impressed with Strip Steak,wasnt really impressed strip steak,negative
Have been going since 2007 and every meal has been awesome!!,1,Have been going since  and every meal has been awesome,going since every meal awesome,positive
Our server was very nice and attentive as were the other serving staff.,1,Our server was very nice and attentive as were the other serving staff,server nice attentive serving staff,positive
The cashier was friendly and even brought the food out to me.,1,The cashier was friendly and even brought the food out to me,cashier friendly even brought food,positive
I work in the hospitality industry in Paradise Valley and have refrained from recommending Cibo any longer.,0,I work in the hospitality industry in Paradise Valley and have refrained from recommending Cibo any longer,work hospitality industry paradise valley refrained recommending cibo longer,negative
The atmosphere here is fun.,1,The atmosphere here is fun,atmosphere fun,positive
Would not recommend to others.,0,Would not recommend to others,would recommend others,negative
"Service is quick and even ""to go"" orders are just like we like it!",1,Service is quick and even to go orders are just like we like it,service quick even go order like like,positive
"I mean really, how do you get so famous for your fish and chips when it's so terrible!?!",0,I mean really how do you get so famous for your fish and chips when its so terrible,mean really get famous fish chip terrible,negative
"That said, our mouths and bellies were still quite pleased.",1,That said our mouths and bellies were still quite pleased,said mouth belly still quite pleased,positive
Not my thing.,0,Not my thing,thing,negative
2 Thumbs Up!!,1, Thumbs Up,thumb,positive
If you are reading this please don't go there.,0,If you are reading this please dont go there,reading please dont go,negative
"I loved the grilled pizza, reminded me of legit Italian pizza.",1,I loved the grilled pizza reminded me of legit Italian pizza,loved grilled pizza reminded legit italian pizza,positive
Only Pros : Large seating area/ Nice bar area/ Great simple drink menu/ The BEST brick oven pizza with homemade dough!,1,Only Pros  Large seating area Nice bar area Great simple drink menu The BEST brick oven pizza with homemade dough,pro large seating area nice bar area great simple drink menu best brick oven pizza homemade dough,positive
They have a really nice atmosphere.,1,They have a really nice atmosphere,really nice atmosphere,positive
Tonight I had the Elk Filet special...and it sucked.,0,Tonight I had the Elk Filet specialand it sucked,tonight elk filet specialand sucked,negative
"After one bite, I was hooked.",1,After one bite I was hooked,one bite hooked,positive
We ordered some old classics and some new dishes after going there a few times and were sorely disappointed with everything.,0,We ordered some old classics and some new dishes after going there a few times and were sorely disappointed with everything,ordered old classic new dish going time sorely disappointed everything,negative
"Cute, quaint, simple, honest.",1,Cute quaint simple honest,cute quaint simple honest,positive
The chicken was deliciously seasoned and had the perfect fry on the outside and moist chicken on the inside.,1,The chicken was deliciously seasoned and had the perfect fry on the outside and moist chicken on the inside,chicken deliciously seasoned perfect fry outside moist chicken inside,positive
"The food was great as always, compliments to the chef.",1,The food was great as always compliments to the chef,food great always compliment chef,positive
Special thanks to Dylan T. for the recommendation on what to order :) All yummy for my tummy.,1,Special thanks to Dylan T for the recommendation on what to order  All yummy for my tummy,special thanks dylan recommendation order yummy tummy,positive
Awesome selection of beer.,1,Awesome selection of beer,awesome selection beer,positive
Great food and awesome service!,1,Great food and awesome service,great food awesome service,positive
"One nice thing was that they added gratuity on the bill since our party was larger than 6 or 8, and they didn't expect more tip than that.",1,One nice thing was that they added gratuity on the bill since our party was larger than  or  and they didnt expect more tip than that,one nice thing added gratuity bill since party larger didnt expect tip,positive
A FLY was in my apple juice.. A FLY!!!!!!!!,0,A FLY was in my apple juice A FLY,fly apple juice fly,negative
The Han Nan Chicken was also very tasty.,1,The Han Nan Chicken was also very tasty,han nan chicken also tasty,positive
"As for the service, I thought it was good.",1,As for the service I thought it was good,service thought good,positive
"The food was barely lukewarm, so it must have been sitting waiting for the server to bring it out to us.",0,The food was barely lukewarm so it must have been sitting waiting for the server to bring it out to us,food barely lukewarm must sitting waiting server bring u,negative
Ryan's Bar is definitely one Edinburgh establishment I won't be revisiting.,0,Ryans Bar is definitely one Edinburgh establishment I wont be revisiting,ryans bar definitely one edinburgh establishment wont revisiting,negative
Nicest Chinese restaurant I've been in a while.,1,Nicest Chinese restaurant Ive been in a while,nicest chinese restaurant ive,positive
"Overall, I like there food and the service.",1,Overall I like there food and the service,overall like food service,positive
They also now serve Indian naan bread with hummus and some spicy pine nut sauce that was out of this world.,1,They also now serve Indian naan bread with hummus and some spicy pine nut sauce that was out of this world,also serve indian naan bread hummus spicy pine nut sauce world,positive
"Probably never coming back, and wouldn't recommend it.",0,Probably never coming back and wouldnt recommend it,probably never coming back wouldnt recommend,negative
"Friend's pasta -- also bad, he barely touched it.",0,Friends pasta  also bad he barely touched it,friend pasta also bad barely touched,negative
"Try them in the airport to experience some tasty food and speedy, friendly service.",1,Try them in the airport to experience some tasty food and speedy friendly service,try airport experience tasty food speedy friendly service,positive
I love the decor with the Chinese calligraphy wall paper.,1,I love the decor with the Chinese calligraphy wall paper,love decor chinese calligraphy wall paper,positive
Never had anything to complain about here.,1,Never had anything to complain about here,never anything complain,positive
The restaurant is very clean and has a family restaurant feel to it.,1,The restaurant is very clean and has a family restaurant feel to it,restaurant clean family restaurant feel,positive
It was way over fried.,0,It was way over fried,way fried,negative
I'm not sure how long we stood there but it was long enough for me to begin to feel awkwardly out of place.,0,Im not sure how long we stood there but it was long enough for me to begin to feel awkwardly out of place,im sure long stood long enough begin feel awkwardly place,negative
"When I opened the sandwich, I was impressed, but not in a good way.",0,When I opened the sandwich I was impressed but not in a good way,opened sandwich impressed good way,negative
Will not be back!,0,Will not be back,back,negative
There was a warm feeling with the service and I felt like their guest for a special treat.,1,There was a warm feeling with the service and I felt like their guest for a special treat,warm feeling service felt like guest special treat,positive
An extensive menu provides lots of options for breakfast.,1,An extensive menu provides lots of options for breakfast,extensive menu provides lot option breakfast,positive
"I always order from the vegetarian menu during dinner, which has a wide array of options to choose from.",1,I always order from the vegetarian menu during dinner which has a wide array of options to choose from,always order vegetarian menu dinner wide array option choose,positive
"I have watched their prices inflate, portions get smaller and management attitudes grow rapidly!",0,I have watched their prices inflate portions get smaller and management attitudes grow rapidly,watched price inflate portion get smaller management attitude grow rapidly,negative
Wonderful lil tapas and the ambience made me feel all warm and fuzzy inside.,1,Wonderful lil tapas and the ambience made me feel all warm and fuzzy inside,wonderful lil tapa ambience made feel warm fuzzy inside,positive
"I got to enjoy the seafood salad, with a fabulous vinegrette.",1,I got to enjoy the seafood salad with a fabulous vinegrette,got enjoy seafood salad fabulous vinegrette,positive
"The wontons were thin, not thick and chewy, almost melt in your mouth.",1,The wontons were thin not thick and chewy almost melt in your mouth,wonton thin thick chewy almost melt mouth,positive
"Level 5 spicy was perfect, where spice didn't over-whelm the soup.",1,Level  spicy was perfect where spice didnt overwhelm the soup,level spicy perfect spice didnt overwhelm soup,positive
We were sat right on time and our server from the get go was FANTASTIC!,1,We were sat right on time and our server from the get go was FANTASTIC,sat right time server get go fantastic,positive
"Main thing I didn't enjoy is that the crowd is of older crowd, around mid 30s and up.",0,Main thing I didnt enjoy is that the crowd is of older crowd around mid s and up,main thing didnt enjoy crowd older crowd around mid,negative
"When I'm on this side of town, this will definitely be a spot I'll hit up again!",1,When Im on this side of town this will definitely be a spot Ill hit up again,im side town definitely spot ill hit,positive
I had to wait over 30 minutes to get my drink and longer to get 2 arepas.,0,I had to wait over  minutes to get my drink and longer to get  arepas,wait minute get drink longer get arepas,negative
This is a GREAT place to eat!,1,This is a GREAT place to eat,great place eat,positive
The jalapeno bacon is soooo good.,1,The jalapeno bacon is soooo good,jalapeno bacon soooo good,positive
The service was poor and thats being nice.,0,The service was poor and thats being nice,service poor thats nice,negative
"Food was good, service was good, Prices were good.",1,Food was good service was good Prices were good,food good service good price good,positive
The place was not clean and the food oh so stale!,0,The place was not clean and the food oh so stale,place clean food oh stale,negative
"The chicken dishes are OK, the beef is like shoe leather.",0,The chicken dishes are OK the beef is like shoe leather,chicken dish ok beef like shoe leather,negative
But the service was beyond bad.,0,But the service was beyond bad,service beyond bad,negative
"I'm so happy to be here!!!""",1,Im so happy to be here,im happy,positive
Tasted like dirt.,0,Tasted like dirt,tasted like dirt,negative
One of the few places in Phoenix that I would definately go back to again .,1,One of the few places in Phoenix that I would definately go back to again ,one place phoenix would definately go back,positive
The block was amazing.,1,The block was amazing,block amazing,positive
"It's close to my house, it's low-key, non-fancy, affordable prices, good food.",1,Its close to my house its lowkey nonfancy affordable prices good food,close house lowkey nonfancy affordable price good food,positive
* Both the Hot & Sour & the Egg Flower Soups were absolutely 5 Stars!,1, Both the Hot  Sour  the Egg Flower Soups were absolutely  Stars,hot sour egg flower soup absolutely star,positive
My sashimi was poor quality being soggy and tasteless.,0,My sashimi was poor quality being soggy and tasteless,sashimi poor quality soggy tasteless,negative
Great time - family dinner on a Sunday night.,1,Great time  family dinner on a Sunday night,great time family dinner sunday night,positive
"the food is not tasty at all, not to say its ""real traditional Hunan style"".",0,the food is not tasty at all not to say its real traditional Hunan style,food tasty say real traditional hunan style,negative
"What did bother me, was the slow service.",0,What did bother me was the slow service,bother slow service,negative
The flair bartenders are absolutely amazing!,1,The flair bartenders are absolutely amazing,flair bartender absolutely amazing,positive
Their frozen margaritas are WAY too sugary for my taste.,0,Their frozen margaritas are WAY too sugary for my taste,frozen margarita way sugary taste,negative
These were so good we ordered them twice.,1,These were so good we ordered them twice,good ordered twice,positive
So in a nutshell: 1) The restaraunt smells like a combination of a dirty fish market and a sewer.,0,So in a nutshell  The restaraunt smells like a combination of a dirty fish market and a sewer,nutshell restaraunt smell like combination dirty fish market sewer,negative
My girlfriend's veal was very bad.,0,My girlfriends veal was very bad,girlfriend veal bad,negative
"Unfortunately, it was not good.",0,Unfortunately it was not good,unfortunately good,negative
I had a pretty satifying experience.,1,I had a pretty satifying experience,pretty satifying experience,positive
Join the club and get awesome offers via email.,1,Join the club and get awesome offers via email,join club get awesome offer via email,positive
"Perfect for someone (me) who only likes beer ice cold, or in this case, even colder.",1,Perfect for someone me who only likes beer ice cold or in this case even colder,perfect someone like beer ice cold case even colder,positive
Bland and flavorless is a good way of describing the barely tepid meat.,0,Bland and flavorless is a good way of describing the barely tepid meat,bland flavorless good way describing barely tepid meat,negative
"The chains, which I'm no fan of, beat this place easily.",0,The chains which Im no fan of beat this place easily,chain im fan beat place easily,negative
The nachos are a MUST HAVE!,1,The nachos are a MUST HAVE,nacho must,positive
We will not be coming back.,0,We will not be coming back,coming back,negative
"I don't have very many words to say about this place, but it does everything pretty well.",1,I dont have very many words to say about this place but it does everything pretty well,dont many word say place everything pretty well,positive
"The staff is super nice and very quick even with the crazy crowds of the downtown juries, lawyers, and court staff.",1,The staff is super nice and very quick even with the crazy crowds of the downtown juries lawyers and court staff,staff super nice quick even crazy crowd downtown jury lawyer court staff,positive
"Great atmosphere, friendly and fast service.",1,Great atmosphere friendly and fast service,great atmosphere friendly fast service,positive
When I received my Pita it was huge it did have a lot of meat in it so thumbs up there.,1,When I received my Pita it was huge it did have a lot of meat in it so thumbs up there,received pita huge lot meat thumb,positive
Once your food arrives it's meh.,0,Once your food arrives its meh,food arrives meh,negative
