Review,Liked,CleanedText,ProcessedText,Sentiment
The inside is really quite nice and very clean.,1,The inside is really quite nice and very clean,inside really quite nice clean,positive
The food was outstanding and the prices were very reasonable.,1,The food was outstanding and the prices were very reasonable,food outstanding price reasonable,positive
I don't think I'll be running back to Carly's anytime soon for food.,0,I dont think Ill be running back to Carlys anytime soon for food,dont think ill running back carlys anytime soon food,negative
"This is was due to the fact that it took 20 minutes to be acknowledged, then another 35 minutes to get our food...and they kept forgetting things.",0,This is was due to the fact that it took  minutes to be acknowledged then another  minutes to get our foodand they kept forgetting things,due fact took minute acknowledged another minute get foodand kept forgetting thing,negative
"Love the margaritas, too!",1,Love the margaritas too,love margarita,positive
This was my first and only Vegas buffet and it did not disappoint.,1,This was my first and only Vegas buffet and it did not disappoint,first vega buffet disappoint,positive
"Very good, though!",1,Very good though,good though,positive
The one down note is the ventilation could use some upgrading.,0,The one down note is the ventilation could use some upgrading,one note ventilation could use upgrading,negative
Great pork sandwich.,1,Great pork sandwich,great pork sandwich,positive
Don't waste your time here.,0,Dont waste your time here,dont waste time,negative
"Total letdown, I would much rather just go to the Camelback Flower Shop and Cartel Coffee.",0,Total letdown I would much rather just go to the Camelback Flower Shop and Cartel Coffee,total letdown would much rather go camelback flower shop cartel coffee,negative
"Third, the cheese on my friend's burger was cold.",0,Third the cheese on my friends burger was cold,third cheese friend burger cold,negative
We enjoy their pizza and brunch.,1,We enjoy their pizza and brunch,enjoy pizza brunch,positive
The steaks are all well trimmed and also perfectly cooked.,1,The steaks are all well trimmed and also perfectly cooked,steak well trimmed also perfectly cooked,positive
We had a group of 70+ when we claimed we would only have 40 and they handled us beautifully.,1,We had a group of  when we claimed we would only have  and they handled us beautifully,group claimed would handled u beautifully,positive
I LOVED it!,1,I LOVED it,loved,positive
We asked for the bill to leave without eating and they didn't bring that either.,0,We asked for the bill to leave without eating and they didnt bring that either,asked bill leave without eating didnt bring either,negative
"This place is a jewel in Las Vegas, and exactly what I've been hoping to find in nearly ten years living here.",1,This place is a jewel in Las Vegas and exactly what Ive been hoping to find in nearly ten years living here,place jewel la vega exactly ive hoping find nearly ten year living,positive
Seafood was limited to boiled shrimp and crab legs but the crab legs definitely did not taste fresh.,0,Seafood was limited to boiled shrimp and crab legs but the crab legs definitely did not taste fresh,seafood limited boiled shrimp crab leg crab leg definitely taste fresh,negative
The selection of food was not the best.,0,The selection of food was not the best,selection food best,negative
Delicious and I will absolutely be back!,1,Delicious and I will absolutely be back,delicious absolutely back,positive
"This isn't a small family restaurant, this is a fine dining establishment.",1,This isnt a small family restaurant this is a fine dining establishment,isnt small family restaurant fine dining establishment,positive
They had a toro tartare with a cavier that was extraordinary and I liked the thinly sliced wagyu with white truffle.,1,They had a toro tartare with a cavier that was extraordinary and I liked the thinly sliced wagyu with white truffle,toro tartare cavier extraordinary liked thinly sliced wagyu white truffle,positive
I dont think I will be back for a very long time.,0,I dont think I will be back for a very long time,dont think back long time,negative
"It was attached to a gas station, and that is rarely a good sign.",0,It was attached to a gas station and that is rarely a good sign,attached gas station rarely good sign,negative
How awesome is that.,1,How awesome is that,awesome,positive
I will be back many times soon.,1,I will be back many times soon,back many time soon,positive
The menu had so much good stuff on it i could not decide!,1,The menu had so much good stuff on it i could not decide,menu much good stuff could decide,positive
"Worse of all, he humiliated his worker right in front of me..Bunch of horrible name callings.",0,Worse of all he humiliated his worker right in front of meBunch of horrible name callings,worse humiliated worker right front mebunch horrible name calling,negative
CONCLUSION: Very filling meals.,1,CONCLUSION Very filling meals,conclusion filling meal,positive
Their daily specials are always a hit with my group.,1,Their daily specials are always a hit with my group,daily special always hit group,positive
And then tragedy struck.,0,And then tragedy struck,tragedy struck,negative
The pancake was also really good and pretty large at that.,1,The pancake was also really good and pretty large at that,pancake also really good pretty large,positive
"This was my first crawfish experience, and it was delicious!",1,This was my first crawfish experience and it was delicious,first crawfish experience delicious,positive
Their monster chicken fried steak and eggs is my all time favorite.,1,Their monster chicken fried steak and eggs is my all time favorite,monster chicken fried steak egg time favorite,positive
Waitress was sweet and funny.,1,Waitress was sweet and funny,waitress sweet funny,positive
"I also had to taste my Mom's multi-grain pumpkin pancakes with pecan butter and they were amazing, fluffy, and delicious!",1,I also had to taste my Moms multigrain pumpkin pancakes with pecan butter and they were amazing fluffy and delicious,also taste mom multigrain pumpkin pancake pecan butter amazing fluffy delicious,positive
"I'd rather eat airline food, seriously.",0,Id rather eat airline food seriously,id rather eat airline food seriously,negative
Cant say enough good things about this place.,1,Cant say enough good things about this place,cant say enough good thing place,positive
The ambiance was incredible.,1,The ambiance was incredible,ambiance incredible,positive
The waitress and manager are so friendly.,1,The waitress and manager are so friendly,waitress manager friendly,positive
I would not recommend this place.,0,I would not recommend this place,would recommend place,negative
Overall I wasn't very impressed with Noca.,0,Overall I wasnt very impressed with Noca,overall wasnt impressed noca,negative
My gyro was basically lettuce only.,0,My gyro was basically lettuce only,gyro basically lettuce,negative
Terrible service!,0,Terrible service,terrible service,negative
Thoroughly disappointed!,0,Thoroughly disappointed,thoroughly disappointed,negative
"I don't each much pasta, but I love the homemade /hand made pastas and thin pizzas here.",1,I dont each much pasta but I love the homemade hand made pastas and thin pizzas here,dont much pasta love homemade hand made pasta thin pizza,positive
"Give it a try, you will be happy you did.",1,Give it a try you will be happy you did,give try happy,positive
By far the BEST cheesecurds we have ever had!,1,By far the BEST cheesecurds we have ever had,far best cheesecurds ever,positive
Reasonably priced also!,1,Reasonably priced also,reasonably priced also,positive
Everything was perfect the night we were in.,1,Everything was perfect the night we were in,everything perfect night,positive
The food is very good for your typical bar food.,1,The food is very good for your typical bar food,food good typical bar food,positive
it was a drive to get there.,0,it was a drive to get there,drive get,negative
"At first glance it is a lovely bakery cafe - nice ambiance, clean, friendly staff.",1,At first glance it is a lovely bakery cafe  nice ambiance clean friendly staff,first glance lovely bakery cafe nice ambiance clean friendly staff,positive
"Anyway, I do not think i will go back there.",0,Anyway I do not think i will go back there,anyway think go back,negative
"Point your finger at any item on the menu, order it and you won't be disappointed.",1,Point your finger at any item on the menu order it and you wont be disappointed,point finger item menu order wont disappointed,positive
"Oh this is such a thing of beauty, this restaurant.",1,Oh this is such a thing of beauty this restaurant,oh thing beauty restaurant,positive
If you haven't gone here GO NOW!,1,If you havent gone here GO NOW,havent gone go,positive
"A greasy, unhealthy meal.",0,A greasy unhealthy meal,greasy unhealthy meal,negative
first time there and might just be the last.,0,first time there and might just be the last,first time might last,negative
Those burgers were amazing.,1,Those burgers were amazing,burger amazing,positive
"Similarly, the delivery man did not say a word of apology when our food was 45 minutes late.",0,Similarly the delivery man did not say a word of apology when our food was  minutes late,similarly delivery man say word apology food minute late,negative
And it was way to expensive.,0,And it was way to expensive,way expensive,negative
"Be sure to order dessert, even if you need to pack it to-go - the tiramisu and cannoli are both to die for.",1,Be sure to order dessert even if you need to pack it togo  the tiramisu and cannoli are both to die for,sure order dessert even need pack togo tiramisu cannoli die,positive
This was my first time and I can't wait until the next.,1,This was my first time and I cant wait until the next,first time cant wait next,positive
The bartender was also nice.,1,The bartender was also nice,bartender also nice,positive
Everything was good and tasty!,1,Everything was good and tasty,everything good tasty,positive
This place is two thumbs up....way up.,1,This place is two thumbs upway up,place two thumb upway,positive
"The best place in Vegas for breakfast (just check out a Sat, or Sun.",1,The best place in Vegas for breakfast just check out a Sat or Sun,best place vega breakfast check sat sun,positive
"If you love authentic Mexican food and want a whole bunch of interesting, yet delicious meats to choose from, you need to try this place.",1,If you love authentic Mexican food and want a whole bunch of interesting yet delicious meats to choose from you need to try this place,love authentic mexican food want whole bunch interesting yet delicious meat choose need try place,positive
Terrible management.,0,Terrible management,terrible management,negative
An excellent new restaurant by an experienced Frenchman.,1,An excellent new restaurant by an experienced Frenchman,excellent new restaurant experienced frenchman,positive
If there were zero stars I would give it zero stars.,0,If there were zero stars I would give it zero stars,zero star would give zero star,negative
"Great steak, great sides, great wine, amazing desserts.",1,Great steak great sides great wine amazing desserts,great steak great side great wine amazing dessert,positive
Worst martini ever!,0,Worst martini ever,worst martini ever,negative
The steak and the shrimp are in my opinion the best entrees at GC.,1,The steak and the shrimp are in my opinion the best entrees at GC,steak shrimp opinion best entree gc,positive
I had the opportunity today to sample your amazing pizzas!,1,I had the opportunity today to sample your amazing pizzas,opportunity today sample amazing pizza,positive
We waited for thirty minutes to be seated (although there were 8 vacant tables and we were the only folks waiting).,0,We waited for thirty minutes to be seated although there were  vacant tables and we were the only folks waiting,waited thirty minute seated although vacant table folk waiting,negative
The yellowtail carpaccio was melt in your mouth fresh.,1,The yellowtail carpaccio was melt in your mouth fresh,yellowtail carpaccio melt mouth fresh,positive
I won't try going back there even if it's empty.,0,I wont try going back there even if its empty,wont try going back even empty,negative
"No, I'm going to eat the potato that I found some strangers hair in it.",0,No Im going to eat the potato that I found some strangers hair in it,im going eat potato found stranger hair,negative
Just spicy enough.. Perfect actually.,1,Just spicy enough Perfect actually,spicy enough perfect actually,positive
Last night was my second time dining here and I was so happy I decided to go back!,1,Last night was my second time dining here and I was so happy I decided to go back,last night second time dining happy decided go back,positive
"not even a ""hello, we will be right with you.""",0,not even a hello we will be right with you,even hello right,negative
The desserts were a bit strange.,0,The desserts were a bit strange,dessert bit strange,negative
My boyfriend and I came here for the first time on a recent trip to Vegas and could not have been more pleased with the quality of food and service.,1,My boyfriend and I came here for the first time on a recent trip to Vegas and could not have been more pleased with the quality of food and service,boyfriend came first time recent trip vega could pleased quality food service,positive
"I really do recommend this place, you can go wrong with this donut place!",1,I really do recommend this place you can go wrong with this donut place,really recommend place go wrong donut place,positive
Nice ambiance.,1,Nice ambiance,nice ambiance,positive
I would recommend saving room for this!,1,I would recommend saving room for this,would recommend saving room,positive
I guess maybe we went on an off night but it was disgraceful.,0,I guess maybe we went on an off night but it was disgraceful,guess maybe went night disgraceful,negative
"However, my recent experience at this particular location was not so good.",0,However my recent experience at this particular location was not so good,however recent experience particular location good,negative
"I know this is not like the other restaurants at all, something is very off here!",0,I know this is not like the other restaurants at all something is very off here,know like restaurant something,negative
AVOID THIS ESTABLISHMENT!,0,AVOID THIS ESTABLISHMENT,avoid establishment,negative
I think this restaurant suffers from not trying hard enough.,0,I think this restaurant suffers from not trying hard enough,think restaurant suffers trying hard enough,negative
All of the tapas dishes were delicious!,1,All of the tapas dishes were delicious,tapa dish delicious,positive
I *heart* this place.,1,I heart this place,heart place,positive
My salad had a bland vinegrette on the baby greens and hearts of Palm.,0,My salad had a bland vinegrette on the baby greens and hearts of Palm,salad bland vinegrette baby green heart palm,negative
After two I felt disgusting.,0,After two I felt disgusting,two felt disgusting,negative
A good time!,1,A good time,good time,positive
I believe that this place is a great stop for those with a huge belly and hankering for sushi.,1,I believe that this place is a great stop for those with a huge belly and hankering for sushi,believe place great stop huge belly hankering sushi,positive
Generous portions and great taste.,1,Generous portions and great taste,generous portion great taste,positive
I will never go back to this place and will never ever recommended this place to anyone!,0,I will never go back to this place and will never ever recommended this place to anyone,never go back place never ever recommended place anyone,negative
"The servers went back and forth several times, not even so much as an ""Are you being helped?""",0,The servers went back and forth several times not even so much as an Are you being helped,server went back forth several time even much helped,negative
Food was delicious!,1,Food was delicious,food delicious,positive
AN HOUR... seriously?,0,AN HOUR seriously,hour seriously,negative
I consider this theft.,0,I consider this theft,consider theft,negative
Eew... This location needs a complete overhaul.,0,Eew This location needs a complete overhaul,eew location need complete overhaul,negative
We recently witnessed her poor quality of management towards other guests as well.,0,We recently witnessed her poor quality of management towards other guests as well,recently witnessed poor quality management towards guest well,negative
Waited and waited and waited.,0,Waited and waited and waited,waited waited waited,negative
"He also came back to check on us regularly, excellent service.",1,He also came back to check on us regularly excellent service,also came back check u regularly excellent service,positive
Our server was super nice and checked on us many times.,1,Our server was super nice and checked on us many times,server super nice checked u many time,positive
"The pizza tasted old, super chewy in not a good way.",0,The pizza tasted old super chewy in not a good way,pizza tasted old super chewy good way,negative
I swung in to give them a try but was deeply disappointed.,0,I swung in to give them a try but was deeply disappointed,swung give try deeply disappointed,negative
Service was good and the company was better!,1,Service was good and the company was better,service good company better,positive
The staff are also very friendly and efficient.,1,The staff are also very friendly and efficient,staff also friendly efficient,positive
"As for the service: I'm a fan, because it's quick and you're being served by some nice folks.",1,As for the service Im a fan because its quick and youre being served by some nice folks,service im fan quick youre served nice folk,positive
Boy was that sucker dry!!.,0,Boy was that sucker dry,boy sucker dry,negative
Over rated.,0,Over rated,rated,negative
"If you look for authentic Thai food, go else where.",0,If you look for authentic Thai food go else where,look authentic thai food go else,negative
Their steaks are 100% recommended!,1,Their steaks are  recommended,steak recommended,positive
After I pulled up my car I waited for another 15 minutes before being acknowledged.,0,After I pulled up my car I waited for another  minutes before being acknowledged,pulled car waited another minute acknowledged,negative
Great food and great service in a clean and friendly setting.,1,Great food and great service in a clean and friendly setting,great food great service clean friendly setting,positive
"All in all, I can assure you I'll be back.",1,All in all I can assure you Ill be back,assure ill back,positive
I hate those things as much as cheap quality black olives.,0,I hate those things as much as cheap quality black olives,hate thing much cheap quality black olive,negative
"My breakfast was perpared great, with a beautiful presentation of 3 giant slices of Toast, lightly dusted with powdered sugar.",1,My breakfast was perpared great with a beautiful presentation of  giant slices of Toast lightly dusted with powdered sugar,breakfast perpared great beautiful presentation giant slice toast lightly dusted powdered sugar,positive
The kids play area is NASTY!,0,The kids play area is NASTY,kid play area nasty,negative
Great place fo take out or eat in.,1,Great place fo take out or eat in,great place fo take eat,positive
The waitress was friendly and happy to accomodate for vegan/veggie options.,1,The waitress was friendly and happy to accomodate for veganveggie options,waitress friendly happy accomodate veganveggie option,positive
OMG I felt like I had never eaten Thai food until this dish.,1,OMG I felt like I had never eaten Thai food until this dish,omg felt like never eaten thai food dish,positive
"It was extremely ""crumby"" and pretty tasteless.",0,It was extremely crumby and pretty tasteless,extremely crumby pretty tasteless,negative
It was a pale color instead of nice and char and has NO flavor.,0,It was a pale color instead of nice and char and has NO flavor,pale color instead nice char flavor,negative
The croutons also taste homemade which is an extra plus.,1,The croutons also taste homemade which is an extra plus,crouton also taste homemade extra plus,positive
I got home to see the driest damn wings ever!,0,I got home to see the driest damn wings ever,got home see driest damn wing ever,negative
It'll be a regular stop on my trips to Phoenix!,1,Itll be a regular stop on my trips to Phoenix,itll regular stop trip phoenix,positive
I really enjoyed Crema Café before they expanded. I even told friends they had the BEST breakfast.,1,I really enjoyed Crema Caf before they expanded I even told friends they had the BEST breakfast,really enjoyed crema caf expanded even told friend best breakfast,positive
Not good for the money.,0,Not good for the money,good money,negative
I miss it and wish they had one in Philadelphia!,1,I miss it and wish they had one in Philadelphia,miss wish one philadelphia,positive
"We got sitting fairly fast, but, ended up waiting 40 minutes just to place our order, another 30 minutes before the food arrived.",0,We got sitting fairly fast but ended up waiting  minutes just to place our order another  minutes before the food arrived,got sitting fairly fast ended waiting minute place order another minute food arrived,negative
They also have the best cheese crisp in town.,1,They also have the best cheese crisp in town,also best cheese crisp town,positive
"Good value, great food, great service.",1,Good value great food great service,good value great food great service,positive
Couldn't ask for a more satisfying meal.,1,Couldnt ask for a more satisfying meal,couldnt ask satisfying meal,positive
The food is good.,1,The food is good,food good,positive
It was awesome.,1,It was awesome,awesome,positive
I just wanted to leave.,0,I just wanted to leave,wanted leave,negative
We made the drive all the way from North Scottsdale... and I was not one bit disappointed!,1,We made the drive all the way from North Scottsdale and I was not one bit disappointed,made drive way north scottsdale one bit disappointed,positive
I will not be eating there again.,0,I will not be eating there again,eating,negative
!....THE OWNERS REALLY REALLY need to quit being soooooo cheap let them wrap my freaking sandwich in two papers not one!,0,THE OWNERS REALLY REALLY need to quit being soooooo cheap let them wrap my freaking sandwich in two papers not one,owner really really need quit soooooo cheap let wrap freaking sandwich two paper one,negative
I checked out this place a couple years ago and was not impressed.,0,I checked out this place a couple years ago and was not impressed,checked place couple year ago impressed,negative
"The chicken I got was definitely reheated and was only ok, the wedges were cold and soggy.",0,The chicken I got was definitely reheated and was only ok the wedges were cold and soggy,chicken got definitely reheated ok wedge cold soggy,negative
"Sorry, I will not be getting food from here anytime soon :(",0,Sorry I will not be getting food from here anytime soon ,sorry getting food anytime soon,negative
An absolute must visit!,1,An absolute must visit,absolute must visit,positive
The cow tongue and cheek tacos are amazing.,1,The cow tongue and cheek tacos are amazing,cow tongue cheek taco amazing,positive
My friend did not like his Bloody Mary.,0,My friend did not like his Bloody Mary,friend like bloody mary,negative
"Despite how hard I rate businesses, its actually rare for me to give a 1 star.",0,Despite how hard I rate businesses its actually rare for me to give a  star,despite hard rate business actually rare give star,negative
They really want to make your experience a good one.,1,They really want to make your experience a good one,really want make experience good one,positive
I will not return.,0,I will not return,return,negative
I had the chicken Pho and it tasted very bland.,0,I had the chicken Pho and it tasted very bland,chicken pho tasted bland,negative
Very disappointing!!!,0,Very disappointing,disappointing,negative
The grilled chicken was so tender and yellow from the saffron seasoning.,1,The grilled chicken was so tender and yellow from the saffron seasoning,grilled chicken tender yellow saffron seasoning,positive
"a drive thru means you do not want to wait around for half an hour for your food, but somehow when we end up going here they make us wait and wait.",0,a drive thru means you do not want to wait around for half an hour for your food but somehow when we end up going here they make us wait and wait,drive thru mean want wait around half hour food somehow end going make u wait wait,negative
Pretty awesome place.,1,Pretty awesome place,pretty awesome place,positive
Ambience is perfect.,1,Ambience is perfect,ambience perfect,positive
Best of luck to the rude and non-customer service focused new management.,0,Best of luck to the rude and noncustomer service focused new management,best luck rude noncustomer service focused new management,negative
Any grandmother can make a roasted chicken better than this one.,0,Any grandmother can make a roasted chicken better than this one,grandmother make roasted chicken better one,negative
I asked multiple times for the wine list and after some time of being ignored I went to the hostess and got one myself.,0,I asked multiple times for the wine list and after some time of being ignored I went to the hostess and got one myself,asked multiple time wine list time ignored went hostess got one,negative
